{
  "id": "REQ-3",
  "title": "Toggle Task Completion",
  "summary": "Users can mark tasks as complete or revert them to incomplete. The visual state updates immediately.",
  "priority": "must",
  "status": "shipped",
  "category": "functional",
  "behaviorStatements": [
    {
      "id": "BS-1",
      "text": "When a user toggles an incomplete task, the system shall mark it as complete and update the visual indicator.",
      "format": "EARS",
      "trigger": "user toggles an incomplete task",
      "response": "the system shall mark it as complete and update the visual indicator"
    },
    {
      "id": "BS-2",
      "text": "When a user toggles a complete task, the system shall mark it as incomplete and update the visual indicator.",
      "format": "EARS",
      "trigger": "user toggles a complete task",
      "response": "the system shall mark it as incomplete and update the visual indicator"
    }
  ],
  "traceRefs": [
    { "path": "docs/features.md", "role": "normative", "label": "Feature spec" }
  ],
  "semanticRefs": {
    "symbols": ["toggleTask", "TaskItem"]
  },
  "verification": {
    "coverageStatus": "full",
    "testRefs": [
      { "path": "__tests__/todo.test.ts", "kind": "unit", "notes": "Covers toggle in both directions" }
    ]
  },
  "implementation": {
    "shippedBy": "CHG-2025-0001-initial-todo"
  },
  "owners": ["todo-team"],
  "tags": ["core", "interaction"],
  "schemaVersion": "0.2.0"
}
